text,label
bizde diğer statülerde olduğu gibi alp yapısı sağlam tam eğitimli tam donanımlı meslek etiğine uygun bir okul ve eğitim kurumu istiyoruz bununla birlikte aidiyet duygusu artacak görev bilinci daha da yükselecektir inanın buda kadroyla olacaktır,['eğitim']
siz indis politika ve güvenlikle ilgili danışmanı değil misiniz bu başıboş sokak köpeği sürüleri ve pawguards oluşumuyla alakanız nedir size ne biz ve belediyelere sesimizi duyurarak çözmeye çalışıyoruz,['çevre-ve-şehircilik']
yazık her havalimanı açtı hava yolunu halkın yolu yaptı milyonlarca para kazandınız havaalanı olmasa nereye gidecektiniz yazık yurt dışına uçabilmem için mit ve kuvvetlerini gönderdi aylarca güvenliği sağladı siz uçabildiniz tenegarları kandırabilirsiniz,['ulaşım']
bir öğretmenin yaşadıkları zorluklar bu yüzden öğretmen okulda olmalı o dağ başı okuldur o yalnız ağaç öğretmendir,['eğitim']
istanbul ankara adana antalya ak partiye verip gideceksiniz değil mi kutsal ittifak,"['siyasi-parti', 'seçim']"
enerjik özverili fazlasıyla çalıştı orkestra şefi gibi çalıştırdı ayrıca çok dürüst buralarda sorun yok kendi twitter de beni takip ettiği yılında dm den chpnin başından gitmesi gerektiğini seçim kazanma sanışının hiç olmadığını yazmıştım fikrim aynı,"['siyasi-figür', 'siyasi-parti', 'seçim']"
vekili seçilen ismail çağlar bayırcının dayısı adem uzunun muhtarlığını iptal ettirmek için açtığım davayı geri çekmem için rüşvet teklif ettiler tabii ki yine kabul etmedim,['adalet']
